{ "$schema": "http://json-schema.org/draft-07/schema#", "title": "Prompt Package Metadata", "type": "object", "required": ["name","summary","inputs","outputs","version","license"], "properties": { "name": {"type":"string"}, "summary": {"type":"string"}, "inputs": {"type":"array","items":{"type":"object","required":["key","type"],"properties":{"key":{"type":"string"},"type":{"type":"string"},"required":{"type":"boolean"},"description":{"type":"string"}}}}, "outputs": {"type":"array","items":{"type":"object","required":["key","type"],"properties":{"key":{"type":"string"},"type":{"type":"string"},"description":{"type":"string"}}}}, "safety_notes": {"type":"string"}, "model_providers": {"type":"array","items":{"type":"string"}}, "eval_notes": {"type":"string"}, "version": {"type":"string"}, "license": {"type":"string"}, "tags": {"type":"array","items":{"type":"string"}} } }
