{"name":"add-copilot-instructions","summary":"Generate repository-level Copilot instructions with guardrails.","inputs":[{"key":"context","type":"string","required":true,"description":"Repo summary"}],"outputs":[{"key":"instructions.json","type":"json"}],"safety_notes":"Avoid secrets and unsafe instructions.","model_providers":["OpenAI","AzureOpenAI"],"eval_notes":"Check minified JSON-only output.","version":"2.0.0","license":"MIT","tags":["meta","guardrail"]}
